{
  "$schema": "https://json-schema.org/draft/2020-12/schema",
  "$id": "https://goobers.dev/schemas/config-source-action.schema.json",
  "title": "OnboardingActionEnvelope",
  "description": "Machine-readable result shared by the non-interactive Goobers onboarding actions.",
  "type": "object",
  "additionalProperties": false,
  "required": ["action", "version", "created", "skipped", "path", "nextCommand"],
  "properties": {
    "action": {
      "type": "string",
      "enum": ["stub-sample", "seed-config-source", "stub-agent-instructions"],
      "description": "Which onboarding action produced this envelope."
    },
    "version": {
      "type": "integer",
      "minimum": 1,
      "description": "Envelope version, incremented when the payload shape changes."
    },
    "created": {
      "type": "array",
      "items": { "type": "string", "minLength": 1 },
      "description": "Paths or logical assets installed by the action."
    },
    "skipped": {
      "type": "array",
      "items": { "type": "string", "minLength": 1 },
      "description": "Paths or logical assets left untouched because they were already current or pending."
    },
    "path": {
      "type": "string",
      "minLength": 1,
      "description": "Absolute path to the action's destination."
    },
    "nextCommand": {
      "type": "string",
      "minLength": 1,
      "description": "Ready-to-run command that checks or validates the action result."
    }
  }
}
