{
  "action": "seed-config-source",
  "version": 1,
  "created": [
    "instance.yaml.example",
    "gaggles/example/gaggle.yaml",
    "gaggles/example/goobers/implementer/goober.yaml",
    "gaggles/example/goobers/implementer/instructions.md",
    "gaggles/example/goobers/reviewer/goober.yaml",
    "gaggles/example/goobers/reviewer/instructions.md",
    "gaggles/example/workflows/quickstart.yaml"
  ],
  "skipped": [
    "manifest.yaml"
  ],
  "path": "$SOURCE",
  "nextCommand": "goobers validate --source-tree --json '$SOURCE'"
}
